<?xml version="1.0" encoding="utf-8"?>
<StoreBranches xmlns:xsi="http://www.w3.org/2001/XMLSchema-instance" xsi:noNamespaceSchemaLocation="../schemas/schema-1.xsd">
    <StoreBranch id="http://example.org/store/StoreBranch1">
        <Name xml:lang="cs">Albert Liberec, Žižkova</Name>
        <has_warehouse>false</has_warehouse>
        <Customers>
            <Customer customerId="http://example.org/customer/Petra-Mrkvickova">
                <Given_name>Petra</Given_name>
                <Family_name>Mrkvickova</Family_name>
                <Birth_date>2002-02-02</Birth_date>
                <Phone_number>tel:+420123321231</Phone_number>
            </Customer>
        </Customers>
        <Addresses>
            <Address>
                <City xml:lang="cs">Liberec</City>
                <Street xml:lang="cs">Prokopova, 261</Street>
                <Zip_code>10400</Zip_code>
            </Address>
        </Addresses>
        <CashRegisters>
            <CashRegister registerId="http://example.org/register/1">
                <Number>1</Number>
                <Is_self_checkout>true</Is_self_checkout>
                <Employees>
                    <Employee employeeId="http://example.org/person/Marie-Krasna">
                        <Given_name>Marie</Given_name>
                        <Family_name>Krásná</Family_name>
                    </Employee>
                </Employees>
            </CashRegister>
        </CashRegisters>
        <Employees>
            <Employee employeeId="http://example.org/person/Marie-Krasna">
                <Given_name>Marie</Given_name>
                <Family_name>Krásná</Family_name>
            </Employee>
        </Employees>
    </StoreBranch>

    <StoreBranch id="http://example.org/store/StoreBranch2">
        <Name xml:lang="cs">Albert Olomouc</Name>
        <has_warehouse>false</has_warehouse>
        <Customers>
            <Customer customerId="http://example.org/customer/Marek-Velky">
                <Given_name>Marek</Given_name>
                <Family_name>Veľký</Family_name>
                <Birth_date>2001-01-01</Birth_date>
                <Phone_number>tel:+420777777777</Phone_number>
            </Customer>
        </Customers>
        <Addresses>
            <Address>
                <City xml:lang="cs">Olomouc</City>
                <Street xml:lang="cs">Polska, 1</Street>
                <Zip_code>77900</Zip_code>
            </Address>
        </Addresses>
        <CashRegisters>
            <CashRegister registerId="http://example.org/register/2">
                <Number>2</Number>
                <Is_self_checkout>false</Is_self_checkout>
                <Employees>
                    <Employee employeeId="http://example.org/person/Janko-Mrkvicka">
                        <Given_name>Janko</Given_name>
                        <Family_name>Mrkvicka</Family_name>
                    </Employee>
                </Employees>
            </CashRegister>
        </CashRegisters>
        <Employees>
            <Employee employeeId="http://example.org/person/Janko-Mrkvicka">
                <Given_name>Janko</Given_name>
                <Family_name>Mrkvicka</Family_name>
            </Employee>
        </Employees>
    </StoreBranch>

    <StoreBranch id="http://example.org/store/StoreBranch3">
        <Name xml:lang="cs">Albert Brno</Name>
        <has_warehouse>true</has_warehouse>
        <Customers>
            <Customer customerId="http://example.org/customer/Janka-Cibulkova">
                <Given_name>Janka</Given_name>
                <Family_name>Cibulkova</Family_name>
                <Birth_date>2003-03-03</Birth_date>
                <Phone_number>tel:+420666666666</Phone_number>
            </Customer>
        </Customers>
        <Addresses>
            <Address>
                <City xml:lang="cs">Brno</City>
                <Street xml:lang="cs">Nádražní, 2</Street>
                <Zip_code>60200</Zip_code>
            </Address>
        </Addresses>
        <CashRegisters>
            <CashRegister registerId="http://example.org/register/3">
                <Number>3</Number>
                <Is_self_checkout>true</Is_self_checkout>
                <Employees>
                    <Employee employeeId="http://example.org/person/Peter-Cibulka">
                        <Given_name>Peter</Given_name>
                        <Family_name>Cibulka</Family_name>
                    </Employee>
                </Employees>
            </CashRegister>
        </CashRegisters>
        <Employees>
            <Employee employeeId="http://example.org/person/Peter-Cibulka">
                <Given_name>Peter</Given_name>
                <Family_name>Cibulka</Family_name>
            </Employee>
        </Employees>
    </StoreBranch>
</StoreBranches>
